[
  {
    "id": "FR-A1-GRM-001",
    "version": 1,
    "level": "A1",
    "domain": "GRM",
    "skill": "Être and avoir (to be, to have)",
    "description": "Say who or what you are and what you have, for example 'Je suis anglais' (I am English) and 'J'ai un chien' (I have a dog).",
    "examples": [
      "Je suis anglais. = I am English.",
      "J'ai un chien. = I have a dog."
    ],
    "prerequisites": [],
    "question_types": [
      "mcq",
      "fill_blank",
      "translate_en_fr"
    ],
    "source_refs": [
      {
        "source_id": "RLD-FR",
        "note": "level placement to be checked against Niveau A1 pour le français"
      }
    ],
    "provenance": "ai-drafted",
    "verification_status": "ai-drafted",
    "notes": "Level placement is a common teaching sequence; not yet checked against the RLD inventory."
  },
  {
    "id": "FR-A1-GRM-002",
    "version": 1,
    "level": "A1",
    "domain": "GRM",
    "skill": "Regular -er verbs, present",
    "description": "Talk about what you do regularly, using the biggest family of French action words, for example 'je parle français' (I speak French).",
    "terms_introduced": [
      {
        "term": "-er verbs",
        "plain_explanation": "The biggest family of French action words. Their dictionary form ends in -er, like parler (to speak), and the ending changes to match who is doing the action."
      }
    ],
    "examples": [
      "Je parle français. = I speak French.",
      "Nous habitons à Lyon. = We live in Lyon."
    ],
    "prerequisites": [],
    "question_types": [
      "fill_blank",
      "mcq",
      "error_correction",
      "translate_en_fr"
    ],
    "source_refs": [
      {
        "source_id": "RLD-FR",
        "note": "level placement to be checked against Niveau A1 pour le français"
      }
    ],
    "provenance": "ai-drafted",
    "verification_status": "ai-drafted",
    "notes": "Level placement is a common teaching sequence; not yet checked against the RLD inventory."
  },
  {
    "id": "FR-A1-GRM-003",
    "version": 1,
    "level": "A1",
    "domain": "GRM",
    "skill": "Go, do, want, can (common irregular verbs)",
    "description": "Say where you are going, what you do or make, and what you want or can do, using four very common verbs that do not follow the usual pattern.",
    "terms_introduced": [
      {
        "term": "irregular verbs",
        "plain_explanation": "Common action words that change shape in unpredictable ways, so they are learned by heart, like aller (to go)."
      }
    ],
    "examples": [
      "Je vais à Paris. = I'm going to Paris.",
      "Je veux un café. = I want a coffee.",
      "Tu peux m'aider ? = Can you help me?"
    ],
    "prerequisites": [
      "FR-A1-GRM-001"
    ],
    "question_types": [
      "fill_blank",
      "mcq",
      "translate_en_fr"
    ],
    "source_refs": [
      {
        "source_id": "RLD-FR",
        "note": "level placement to be checked against Niveau A1 pour le français"
      }
    ],
    "provenance": "ai-drafted",
    "verification_status": "ai-drafted",
    "notes": "Level placement is a common teaching sequence; not yet checked against the RLD inventory."
  },
  {
    "id": "FR-A1-GRM-004",
    "version": 1,
    "level": "A1",
    "domain": "GRM",
    "skill": "Masculine and feminine nouns, un/une, le/la",
    "description": "Know whether a French thing-word is masculine or feminine, and use the right 'the' (le, la) and 'a' (un, une) in front of it, for example 'le livre' (the book) and 'une table' (a table).",
    "terms_introduced": [
      {
        "term": "noun",
        "plain_explanation": "A word for a thing, person or place, like 'book', 'teacher' or 'town'."
      },
      {
        "term": "masculine and feminine",
        "plain_explanation": "French sorts every noun into one of two groups. The words around it have to match the group, so it is 'un livre' but 'une table'."
      },
      {
        "term": "article",
        "plain_explanation": "The small word 'the' or 'a' that comes before a noun, such as le, la, un or une."
      }
    ],
    "examples": [
      "le livre = the book",
      "une table = a table"
    ],
    "prerequisites": [],
    "question_types": [
      "mcq",
      "fill_blank"
    ],
    "source_refs": [
      {
        "source_id": "RLD-FR",
        "note": "level placement to be checked against Niveau A1 pour le français"
      }
    ],
    "provenance": "ai-drafted",
    "verification_status": "ai-drafted",
    "notes": "Level placement is a common teaching sequence; not yet checked against the RLD inventory."
  },
  {
    "id": "FR-A1-GRM-005",
    "version": 1,
    "level": "A1",
    "domain": "GRM",
    "skill": "Plurals: the books, some cats",
    "description": "Talk about more than one thing or person, for example 'les livres' (the books) and 'des chats' (some cats).",
    "terms_introduced": [
      {
        "term": "plural",
        "plain_explanation": "The form of a word for more than one thing. In writing it usually ends in -s, but you often can't hear the difference."
      }
    ],
    "examples": [
      "les livres = the books",
      "des chats = some cats"
    ],
    "prerequisites": [
      "FR-A1-GRM-004"
    ],
    "question_types": [
      "mcq",
      "fill_blank",
      "error_correction"
    ],
    "source_refs": [
      {
        "source_id": "RLD-FR",
        "note": "level placement to be checked against Niveau A1 pour le français"
      }
    ],
    "provenance": "ai-drafted",
    "verification_status": "ai-drafted",
    "notes": "Level placement is a common teaching sequence; not yet checked against the RLD inventory."
  },
  {
    "id": "FR-A1-GRM-006",
    "version": 1,
    "level": "A1",
    "domain": "GRM",
    "skill": "Describing words: agreement and position",
    "description": "Describe people and things (tall, small, red, happy) and make the describing word match the thing it describes, for example 'une voiture rouge' (a red car).",
    "terms_introduced": [
      {
        "term": "adjective",
        "plain_explanation": "A describing word, like 'red', 'tall' or 'happy'."
      },
      {
        "term": "agreement",
        "plain_explanation": "Changing a word's ending so it matches the person or thing it goes with, e.g. petit (small) for a man and petite for a woman."
      }
    ],
    "examples": [
      "Il est grand. = He is tall.",
      "Elle est petite. = She is small."
    ],
    "prerequisites": [
      "FR-A1-GRM-001",
      "FR-A1-GRM-004"
    ],
    "question_types": [
      "mcq",
      "fill_blank",
      "error_correction",
      "translate_en_fr"
    ],
    "source_refs": [
      {
        "source_id": "RLD-FR",
        "note": "level placement to be checked against Niveau A1 pour le français"
      }
    ],
    "provenance": "ai-drafted",
    "verification_status": "ai-drafted",
    "notes": "Level placement is a common teaching sequence; not yet checked against the RLD inventory."
  },
  {
    "id": "FR-A1-GRM-007",
    "version": 1,
    "level": "A1",
    "domain": "GRM",
    "skill": "Saying 'not' with ne … pas",
    "description": "Make a sentence negative (saying not) by wrapping the action word in ne ... pas, for example 'je ne parle pas' (I don't speak).",
    "terms_introduced": [
      {
        "term": "ne … pas",
        "plain_explanation": "The two-part way to say 'not' in French: ne goes before the verb and pas goes after it."
      }
    ],
    "examples": [
      "Je ne mange pas. = I'm not eating.",
      "Je ne suis pas fatigué. = I'm not tired."
    ],
    "prerequisites": [
      "FR-A1-GRM-001",
      "FR-A1-GRM-002"
    ],
    "question_types": [
      "fill_blank",
      "error_correction",
      "translate_en_fr",
      "mcq"
    ],
    "source_refs": [
      {
        "source_id": "RLD-FR",
        "note": "level placement to be checked against Niveau A1 pour le français"
      }
    ],
    "provenance": "ai-drafted",
    "verification_status": "ai-drafted",
    "notes": "Level placement is a common teaching sequence; not yet checked against the RLD inventory."
  },
  {
    "id": "FR-A1-GRM-008",
    "version": 1,
    "level": "A1",
    "domain": "GRM",
    "skill": "Yes/no questions: est-ce que and rising voice",
    "description": "Ask questions that can be answered yes or no, either by starting with 'est-ce que' or by raising your voice at the end, for example 'Est-ce que tu parles anglais ?' (Do you speak English?).",
    "terms_introduced": [
      {
        "term": "intonation",
        "plain_explanation": "The rise and fall of your voice. In French you can turn a statement into a question just by raising your voice at the end."
      }
    ],
    "examples": [
      "Est-ce que tu parles anglais ? = Do you speak English?",
      "Tu parles anglais ? = You speak English?"
    ],
    "prerequisites": [
      "FR-A1-GRM-001"
    ],
    "question_types": [
      "mcq",
      "sentence_order",
      "fill_blank",
      "translate_en_fr"
    ],
    "source_refs": [
      {
        "source_id": "RLD-FR",
        "note": "level placement to be checked against Niveau A1 pour le français"
      }
    ],
    "provenance": "ai-drafted",
    "verification_status": "ai-drafted",
    "notes": "Level placement is a common teaching sequence; not yet checked against the RLD inventory."
  },
  {
    "id": "FR-A1-GRM-009",
    "version": 1,
    "level": "A1",
    "domain": "GRM",
    "skill": "Question words: where, when, how, who, what",
    "description": "Ask 'where', 'when', 'how', 'how much', 'who' and 'what' questions, for example 'Où est la gare ?' (Where is the station?).",
    "examples": [
      "Où est la gare ? = Where is the station?",
      "Combien ça coûte ? = How much does it cost?"
    ],
    "prerequisites": [
      "FR-A1-GRM-008"
    ],
    "question_types": [
      "mcq",
      "sentence_order",
      "translate_en_fr",
      "fill_blank"
    ],
    "source_refs": [
      {
        "source_id": "RLD-FR",